jobtitle,company,city,state,country,language,formattedLocation,source,date,snippet,url,onmousedown,latitude,longitude,jobkey,sponsored,expired,indeedApply,formattedLocationFull,formattedRelativeTime,stations
Hadoop Big Data Developer,Blackboard Recruitment,Sandton,GP,ZA,en,"Sandton, Gauteng",Indeed,"Wed, 20 Nov 2019 11:39:30 GMT",Creation of <b>data</b> ingestion pipelines between legacy <b>data</b> warehouses and the big <b>data</b> stack. The incumbent will have the opportunity of working directly across…,http://www.indeed.co.za/viewjob?jk=4dc6a039eb69bff5&qd=_2otc9hbdFJBv5z8Fcdsn2-b0nnsPWs6xM_ANye41tkV07CpYWUlemtjEVO0vTDEY_-taoSSxwsGCgAqkHstT_mLLiO7ijuO4vHeXqrsuqw&indpubnum=9091824477922251&atk=1drajn2dnblv4800,"indeed_clk(this,'9194');",-26.101385,28.04619,4dc6a039eb69bff5,False,False,True,"Sandton, Gauteng",14 days ago,
Data Engineer - Insurance,SET Consulting,Braamfontein,GP,ZA,en,"Braamfontein, Gauteng",SET Consulting,"Wed, 04 Dec 2019 18:27:08 GMT",Degree / Advanced Diploma in Information Technology and Computer Science with 2 - 3 years' <b>Data</b> Engineer / <b>Data</b> <b>Scientist</b> experience essential.,http://www.indeed.co.za/viewjob?jk=84a11bc461d874ba&qd=_2otc9hbdFJBv5z8Fcdsn2-b0nnsPWs6xM_ANye41tkV07CpYWUlemtjEVO0vTDEY_-taoSSxwsGCgAqkHstT_mLLiO7ijuO4vHeXqrsuqw&indpubnum=9091824477922251&atk=1drajn2dnblv4800,"indeed_clk(this,'9194');",-26.198133,28.021814,84a11bc461d874ba,False,False,True,"Braamfontein, Gauteng",14 hours ago,
Business Intelligence Analyst/ Developer,Rewardsco,Umhlanga Rocks,ZN,ZA,en,"Umhlanga Rocks, KwaZulu-Natal",Indeed,"Mon, 02 Dec 2019 10:00:04 GMT",Work closely with the <b>Data</b> Architect and <b>Data</b> <b>Scientist</b> to design and implement BI solutions. <b>Data</b> modelling requirements (reporting and business models).,http://www.indeed.co.za/viewjob?jk=fa4705b8483c7e55&qd=_2otc9hbdFJBv5z8Fcdsn2-b0nnsPWs6xM_ANye41tkV07CpYWUlemtjEVO0vTDEY_-taoSSxwsGCgAqkHstT_mLLiO7ijuO4vHeXqrsuqw&indpubnum=9091824477922251&atk=1drajn2dnblv4800,"indeed_clk(this,'9194');",-29.71667,31.06667,fa4705b8483c7e55,False,False,True,"Umhlanga Rocks, KwaZulu-Natal",2 days ago,
Senior Data Analyst,Goldman Tech Resourcing,Johannesburg,GP,ZA,en,"Johannesburg, Gauteng",Goldman Tech Resourcing,"Thu, 03 Oct 2019 16:05:56 GMT","Proven working experience as a <b>Data</b> <b>Scientist</b> or <b>Data</b> Analyst with some Actuarial experience. Technical expertise regarding <b>data</b> models, database design…",http://www.indeed.co.za/viewjob?jk=163e7092db4e62ec&qd=_2otc9hbdFJBv5z8Fcdsn2-b0nnsPWs6xM_ANye41tkV07CpYWUlemtjEVO0vTDEY_-taoSSxwsGCgAqkHstT_mLLiO7ijuO4vHeXqrsuqw&indpubnum=9091824477922251&atk=1drajn2dnblv4800,"indeed_clk(this,'9194');",-26.20227,28.04363,163e7092db4e62ec,False,False,True,"Johannesburg, Gauteng",30+ days ago,
Data Scientists / Data Warehouse Development Specialists,ZealHR,,GP,ZA,en,"City of Tshwane, Gauteng",ZealHR,"Thu, 12 Sep 2019 16:12:00 GMT",Minimum 3 years working experience in a <b>data</b> warehouse environment with good working knowledge of <b>Data</b> Warehouse principles and best practices.,http://www.indeed.co.za/viewjob?jk=45b0e7be80093988&qd=_2otc9hbdFJBv5z8Fcdsn2-b0nnsPWs6xM_ANye41tkV07CpYWUlemtjEVO0vTDEY_-taoSSxwsGCgAqkHstT_mLLiO7ijuO4vHeXqrsuqw&indpubnum=9091824477922251&atk=1drajn2dnblv4800,"indeed_clk(this,'9194');",-25.633423,27.887644,45b0e7be80093988,False,False,True,"City of Tshwane, Gauteng",30+ days ago,
MIS Analytics Manager,Tumaini Consulting,Centurion,GP,ZA,en,"Centurion, Gauteng",Tumaini Consulting,"Mon, 04 Nov 2019 10:22:17 GMT","The position will require hands on <b>data</b> analysis, coding and modelling, supervising and guiding junior <b>data</b> <b>scientists</b> and assisting in translating technical…",http://www.indeed.co.za/viewjob?jk=cda7ef9b1ce6ed80&qd=_2otc9hbdFJBv5z8Fcdsn2-b0nnsPWs6xM_ANye41tkV07CpYWUlemtjEVO0vTDEY_-taoSSxwsGCgAqkHstT_mLLiO7ijuO4vHeXqrsuqw&indpubnum=9091824477922251&atk=1drajn33robjs800,"indeed_clk(this,'9930');",-25.87444,28.17056,cda7ef9b1ce6ed80,False,False,True,"Centurion, Gauteng",30 days ago,
Specialist: Data Science,ZealHR,,GP,ZA,en,"City of Tshwane, Gauteng",ZealHR,"Fri, 19 Jul 2019 04:12:01 GMT",Participate in the development of junior <b>data</b> <b>scientists</b>. Strong support to the lead and senior <b>data</b> <b>scientists</b>. <b>Data</b> science and analytics frameworks;,http://www.indeed.co.za/viewjob?jk=d8e76b6e12e31874&qd=_2otc9hbdFJBv5z8Fcdsn2-b0nnsPWs6xM_ANye41tkV07CpYWUlemtjEVO0vTDEY_-taoSSxwsGCgAqkHstT_mLLiO7ijuO4vHeXqrsuqw&indpubnum=9091824477922251&atk=1drajn33robjs800,"indeed_clk(this,'9930');",-25.633423,27.887644,d8e76b6e12e31874,False,False,True,"City of Tshwane, Gauteng",4 months ago,
Specialist: Data Science,ZealHR,Cape Town,WC,ZA,en,"Cape Town, Western Cape",ZealHR,"Fri, 19 Jul 2019 04:12:02 GMT",Participate in the development of junior <b>data</b> <b>scientists</b>. Strong support to the lead and senior <b>data</b> <b>scientists</b>. <b>Data</b> science and analytics frameworks;,http://www.indeed.co.za/viewjob?jk=cc22549128827db0&qd=_2otc9hbdFJBv5z8Fcdsn2-b0nnsPWs6xM_ANye41tkV07CpYWUlemtjEVO0vTDEY_-taoSSxwsGCgAqkHstT_mLLiO7ijuO4vHeXqrsuqw&indpubnum=9091824477922251&atk=1drajn33robjs800,"indeed_clk(this,'9930');",-33.91667,18.41667,cc22549128827db0,False,False,True,"Cape Town, Western Cape",4 months ago,
Project Manager,Praekelt.Org,Cape Town,WC,ZA,en,"Cape Town, Western Cape",Praekelt.Org,"Sat, 21 Sep 2019 12:42:27 GMT","You’ll be joining a talented team of developers, service designers, content designers, researchers, <b>data</b> <b>scientists</b> and project managers, building solutions…",http://www.indeed.co.za/viewjob?jk=5e4c33cff39b92f3&qd=_2otc9hbdFJBv5z8Fcdsn2-b0nnsPWs6xM_ANye41tkV07CpYWUlemtjEVO0vTDEY_-taoSSxwsGCgAqkHstT_mLLiO7ijuO4vHeXqrsuqw&indpubnum=9091824477922251&atk=1drajn33robjs800,"indeed_clk(this,'9930');",-33.91667,18.41667,5e4c33cff39b92f3,False,False,True,"Cape Town, Western Cape",30+ days ago,
Software Engineer,ZealHR,Cape Town,WC,ZA,en,"Cape Town, Western Cape",ZealHR,"Wed, 16 Jan 2019 04:10:38 GMT","Experience working in a team environment that includes <b>scientists</b>, engineers, or computer <b>scientists</b>. Knowledge and experience with the ROOT <b>data</b> analysis…",http://www.indeed.co.za/viewjob?jk=1ba3683f15e6caa5&qd=_2otc9hbdFJBv5z8Fcdsn2-b0nnsPWs6xM_ANye41tkV07CpYWUlemtjEVO0vTDEY_-taoSSxwsGCgAqkHstT_mLLiO7ijuO4vHeXqrsuqw&indpubnum=9091824477922251&atk=1drajn33robjs800,"indeed_clk(this,'9930');",-33.91667,18.41667,1ba3683f15e6caa5,False,False,True,"Cape Town, Western Cape",10 months ago,
Python Data Scientist,eHealth4everyone,Abuja,FC,NG,en,Abuja,eHealth4everyone,"Sat, 16 Feb 2019 00:04:36 GMT","The Python <b>Data</b> <b>Scientist</b> will write software codes to query, manipulate, wrangle and analyze datasets. He/she will extract <b>data</b> from different sources and…",http://ng.indeed.com/viewjob?jk=e418ca1cedde4985&qd=_2otc9hbdFJBv5z8Fcdsn2-b0nnsPWs6xM_ANye41tl7mMKM2f9n9GD2lW0Xz8Xx3DmvYiquJUVtcw8CDr6KXVH5Y05AsHEKegFci4mEw_I&indpubnum=9091824477922251&atk=1drajn4egobjs800,"indeed_clk(this,'1295');",9.076478,7.398574,e418ca1cedde4985,False,False,False,Abuja,9 months ago,
Data Scientist,eHealth4everyone,Abuja,FC,NG,en,Abuja,eHealth4everyone,"Mon, 24 Dec 2018 00:04:05 GMT","The <b>Data</b> <b>Scientist</b> will work with the <b>data</b> analyst to discover information hidden in vast amounts of <b>data</b>, and help the organization make smarter decisions to…",http://ng.indeed.com/viewjob?jk=95b8cab30566d6d0&qd=_2otc9hbdFJBv5z8Fcdsn2-b0nnsPWs6xM_ANye41tl7mMKM2f9n9GD2lW0Xz8Xx3DmvYiquJUVtcw8CDr6KXVH5Y05AsHEKegFci4mEw_I&indpubnum=9091824477922251&atk=1drajn4egobjs800,"indeed_clk(this,'1295');",9.076478,7.398574,95b8cab30566d6d0,False,False,False,Abuja,11 months ago,
Data Science Engineer at Kobo360,careersome,,,NG,en,Nigeria,careersome,"Mon, 01 Apr 2019 17:25:07 GMT","We are looking for a <b>data</b> <b>scientist</b> that will help us discover the information hidden in vast amounts of <b>data</b>, and help us make smarter decisions to deliver…",http://ng.indeed.com/viewjob?jk=274d1191fa1230b6&qd=_2otc9hbdFJBv5z8Fcdsn2-b0nnsPWs6xM_ANye41tl7mMKM2f9n9GD2lW0Xz8Xx3DmvYiquJUVtcw8CDr6KXVH5Y05AsHEKegFci4mEw_I&indpubnum=9091824477922251&atk=1drajn4egobjs800,"indeed_clk(this,'1295');",,,274d1191fa1230b6,False,False,False,Nigeria,8 months ago,
Data Scientist at Access Bank Plc,careersome,,,NG,en,Nigeria,careersome,"Thu, 17 Jan 2019 18:59:49 GMT",This recruitment seeks to identify potential <b>data</b> science talents who have been sourced from the just concluded <b>data</b> hack and <b>Data</b> science of Nigeria.,http://ng.indeed.com/viewjob?jk=0a8a6e340c3e44d4&qd=_2otc9hbdFJBv5z8Fcdsn2-b0nnsPWs6xM_ANye41tl7mMKM2f9n9GD2lW0Xz8Xx3DmvYiquJUVtcw8CDr6KXVH5Y05AsHEKegFci4mEw_I&indpubnum=9091824477922251&atk=1drajn4egobjs800,"indeed_clk(this,'1295');",,,0a8a6e340c3e44d4,False,False,False,Nigeria,10 months ago,
Data Analyst at Descasio Limited​,careersome,Lagos,LA,NG,en,Lagos,careersome,"Tue, 05 Nov 2019 11:24:20 GMT",Proven experience as a <b>Data</b> <b>Scientist</b> or <b>Data</b> Analyst. Develop custom <b>data</b> models and algorithms to apply to <b>data</b> sets. What will you be doing?,http://ng.indeed.com/viewjob?jk=52df2c0a4d402ee1&qd=_2otc9hbdFJBv5z8Fcdsn2-b0nnsPWs6xM_ANye41tl7mMKM2f9n9GD2lW0Xz8Xx3DmvYiquJUVtcw8CDr6KXVH5Y05AsHEKegFci4mEw_I&indpubnum=9091824477922251&atk=1drajn4egobjs800,"indeed_clk(this,'1295');",6.45407,3.39467,52df2c0a4d402ee1,False,False,False,Lagos,29 days ago,
Data Scientist at ​Growth in Value Alliance (GV Alliance) Partners,careersome,Lagos,LA,NG,en,Lagos,careersome,"Thu, 07 Nov 2019 17:24:26 GMT",Proven experience as a <b>Data</b> <b>Scientist</b> or <b>Data</b> Analyst. We are recruiting to fill the position of a <b>Data</b> <b>Scientist</b> in Lagos. What will you be doing?,http://ng.indeed.com/viewjob?jk=d1ac949f59c74661&qd=_2otc9hbdFJBv5z8Fcdsn2-b0nnsPWs6xM_ANye41tl7mMKM2f9n9GD2lW0Xz8Xx3DmvYiquJUVtcw8CDr6KXVH5Y05AsHEKegFci4mEw_I&indpubnum=9091824477922251&atk=1drajn4egobjs800,"indeed_clk(this,'1295');",6.45407,3.39467,d1ac949f59c74661,False,False,False,Lagos,27 days ago,
Data Scientist at Snapnet Nigeria Limited,careersome,Lagos,LA,NG,en,Lagos,careersome,"Fri, 08 Mar 2019 11:25:09 GMT","Proven experience as a <b>Data</b> <b>Scientist</b>. Tableau) and <b>data</b> frameworks (e.g. Undertaking <b>data</b> collection, preprocessing and analysis.",http://ng.indeed.com/viewjob?jk=dbe21b1a80f0b285&qd=_2otc9hbdFJBv5z8Fcdsn2-b0nnsPWs6xM_ANye41tl7mMKM2f9n9GD2lW0Xz8Xx3DmvYiquJUVtcw8CDr6KXVH5Y05AsHEKegFci4mEw_I&indpubnum=9091824477922251&atk=1drajn4egobjs800,"indeed_clk(this,'1295');",6.45407,3.39467,dbe21b1a80f0b285,False,False,False,Lagos,9 months ago,
Data Scientist at Onwards Technologies,careersome,Lagos,LA,NG,en,Lagos,careersome,"Mon, 03 Dec 2018 12:49:48 GMT",Able to understand various <b>data</b> structures and common method in <b>data</b> presentation. We are looking for a <b>data</b> <b>scientist</b> that will help us discover the…,http://ng.indeed.com/viewjob?jk=efde1d33f7c4bde9&qd=_2otc9hbdFJBv5z8Fcdsn2-b0nnsPWs6xM_ANye41tl7mMKM2f9n9GD2lW0Xz8Xx3DmvYiquJUVtcw8CDr6KXVH5Y05AsHEKegFci4mEw_I&indpubnum=9091824477922251&atk=1drajn4egobjs800,"indeed_clk(this,'1295');",6.45407,3.39467,efde1d33f7c4bde9,False,False,False,Lagos,12 months ago,
MACHINE LEARNING ENGINEER,Ascentech,Lagos,LA,NG,en,Lagos,Ascentech,"Thu, 26 Sep 2019 10:38:35 GMT","Work closely with <b>Data</b> Engineers and <b>Data</b> <b>Scientists</b> to create analytical variables, metrics and models. Verifying <b>data</b> quality, and/or ensuring it via data…",http://ng.indeed.com/viewjob?jk=5f0d46048e857601&qd=_2otc9hbdFJBv5z8Fcdsn2-b0nnsPWs6xM_ANye41tl7mMKM2f9n9GD2lW0Xz8Xx3DmvYiquJUVtcw8CDr6KXVH5Y05AsHEKegFci4mEw_I&indpubnum=9091824477922251&atk=1drajn4egobjs800,"indeed_clk(this,'1295');",6.45407,3.39467,5f0d46048e857601,False,False,False,Lagos,30+ days ago,
Data Scientist at Foodlocker,careersome,Ibadan,OY,NG,en,Ibadan,careersome,"Tue, 23 Jul 2019 17:24:26 GMT","Foodlocker, an Ibadan-based e-Commerce/Retail startup is hiring an <b>Data</b> <b>Scientist</b>. BSc in Computer Science or any analytical discipline (Mathematics, Physics,…",http://ng.indeed.com/viewjob?jk=1b412d0f7e8ce07e&qd=_2otc9hbdFJBv5z8Fcdsn2-b0nnsPWs6xM_ANye41tl7mMKM2f9n9GD2lW0Xz8Xx3DmvYiquJUVtcw8CDr6KXVH5Y05AsHEKegFci4mEw_I&indpubnum=9091824477922251&atk=1drajn4egobjs800,"indeed_clk(this,'1295');",7.37756,3.90591,1b412d0f7e8ce07e,False,False,False,Ibadan,4 months ago,
Data Scientist at RxAll,careersome,Ibadan,OY,NG,en,Ibadan,careersome,"Sat, 29 Jun 2019 11:30:14 GMT","We need a <b>Data</b> <b>Scientist</b> based in Ibadan, Nigeria to support our <b>Data</b> Team with our work in West Africa. Is an authentication platform through which regulators…",http://ng.indeed.com/viewjob?jk=f109ef1c7b7015b2&qd=_2otc9hbdFJBv5z8Fcdsn2-b0nnsPWs6xM_ANye41tl7mMKM2f9n9GD2lW0Xz8Xx3DmvYiquJUVtcw8CDr6KXVH5Y05AsHEKegFci4mEw_I&indpubnum=9091824477922251&atk=1drajn4egobjs800,"indeed_clk(this,'1295');",7.37756,3.90591,f109ef1c7b7015b2,False,False,False,Ibadan,5 months ago,
Associate Consultant Dig. Business Design & Reinvention (w/m/x),IBM,,DE,NG,de,Delta,IBM,"Wed, 04 Dec 2019 11:12:52 GMT","Als Associate bist Du als Consultant, Designer, <b>Data</b> <b>Scientist</b> oder Technical Specialist Teil eines Projektteams. Du hast ein abgeschlossenes Studium, das u.a.",http://ng.indeed.com/viewjob?jk=56f142e20cbd3b79&qd=_2otc9hbdFJBv5z8Fcdsn2-b0nnsPWs6xM_ANye41tl7mMKM2f9n9GD2lW0Xz8Xx3DmvYiquJUVtcw8CDr6KXVH5Y05AsHEKegFci4mEw_I&indpubnum=9091824477922251&atk=1drajn4egobjs800,"indeed_clk(this,'1295');",,,56f142e20cbd3b79,False,False,False,Delta,21 hours ago,
Instrumentation and Control Engineer,BATELitwin,Lagos,LA,NG,en,Lagos,BATELitwin,"Wed, 24 Jul 2019 15:04:20 GMT","Working coordinately with purchasers, team of engineers, <b>scientists</b>, operational engineers, design engineers and other internal personnel.",http://ng.indeed.com/viewjob?jk=49487405d09004d8&qd=_2otc9hbdFJBv5z8Fcdsn2-b0nnsPWs6xM_ANye41tl7mMKM2f9n9GD2lW0Xz8Xx3DmvYiquJUVtcw8CDr6KXVH5Y05AsHEKegFci4mEw_I&indpubnum=9091824477922251&atk=1drajn4egobjs800,"indeed_clk(this,'1295');",6.45407,3.39467,49487405d09004d8,False,False,False,Lagos,4 months ago,
Initiativbewerbung - Entwickler (m/w/d) Cognitive & Analytics,IBM,,DE,NG,de,Delta,IBM,"Wed, 31 Jul 2019 08:32:51 GMT",Du willst das digitale Zeitalter aktiv mitgestalten? Du begeisterst dich für neue Technologien? Du schaust gern über den Tellerrand und bist auf der Suche nach…,http://ng.indeed.com/viewjob?jk=a83b22bd9e3066b6&qd=_2otc9hbdFJBv5z8Fcdsn2-b0nnsPWs6xM_ANye41tl7mMKM2f9n9GD2lW0Xz8Xx3DmvYiquJUVtcw8CDr6KXVH5Y05AsHEKegFci4mEw_I&indpubnum=9091824477922251&atk=1drajn4egobjs800,"indeed_clk(this,'1295');",,,a83b22bd9e3066b6,False,False,False,Delta,4 months ago,
Local Political or Social Scientist,Social Impact,,,NG,en,Nigeria,Social Impact,"Tue, 17 Sep 2019 22:01:12 GMT","Local Political or Social <b>Scientist</b>, USAID/Nigeria DRG Assessment. Participate in developing the assessment design and <b>data</b> collection instruments.",http://ng.indeed.com/viewjob?jk=08735f757dd679a9&qd=_2otc9hbdFJBv5z8Fcdsn2-b0nnsPWs6xM_ANye41tl7mMKM2f9n9GD2lW0Xz8Xx3DmvYiquJUVtcw8CDr6KXVH5Y05AsHEKegFci4mEw_I&indpubnum=9091824477922251&atk=1drajn4egobjs800,"indeed_clk(this,'1295');",,,08735f757dd679a9,False,False,False,Nigeria,30+ days ago,
Project Administrative Officer,International Institute of Tropical Agriculture (IITA),Ibadan,OY,NG,en,Ibadan,ngojobsinafrica,"Tue, 03 Dec 2019 17:52:58 GMT",Support in <b>data</b> generation of project administration related information. Follow up with <b>scientists</b> to address specific issues raised by donors.,http://ng.indeed.com/viewjob?jk=93aa8f2a5294c40b&qd=_2otc9hbdFJBv5z8Fcdsn2-b0nnsPWs6xM_ANye41tl7mMKM2f9n9GD2lW0Xz8Xx3DmvYiquJUVtcw8CDr6KXVH5Y05AsHEKegFci4mEw_I&indpubnum=9091824477922251&atk=1drajn4egobjs800,"indeed_clk(this,'1295');",7.37756,3.90591,93aa8f2a5294c40b,False,False,False,Ibadan,1 day ago,
Entwickler (m/w/d) - Data Science,P3 group GmbH,,DE,NG,de,Delta,P3 group GmbH,"Thu, 24 Oct 2019 21:52:56 GMT","Arbeite agil mit Softwareentwicklern, <b>Data</b> <b>Scientists</b> und Kunden zusammen, um Produktanforderungen zu definieren. Du arbeitest gerne mit Linux/Unix Systemen.",http://ng.indeed.com/viewjob?jk=6f05b6ace85cb9f5&qd=_2otc9hbdFJBv5z8Fcdsn2-b0nnsPWs6xM_ANye41tl7mMKM2f9n9GD2lW0Xz8Xx3DmvYiquJUVtcw8CDr6KXVH5Y05AsHEKegFci4mEw_I&indpubnum=9091824477922251&atk=1drajn4egobjs800,"indeed_clk(this,'1295');",,,6f05b6ace85cb9f5,False,False,False,Delta,30+ days ago,
Data Scientist (m/w/d),P3 group GmbH,,DE,NG,de,Delta,P3 group GmbH,"Thu, 24 Oct 2019 21:53:49 GMT",(gerne auch mit Promotion) und verfügst über mindestens 1-2 Jahre Erfahrung im Bereich <b>Data</b> Analytics/Data Science.,http://ng.indeed.com/viewjob?jk=490c5af1906e11bb&qd=_2otc9hbdFJBv5z8Fcdsn2-b0nnsPWs6xM_ANye41tl7mMKM2f9n9GD2lW0Xz8Xx3DmvYiquJUVtcw8CDr6KXVH5Y05AsHEKegFci4mEw_I&indpubnum=9091824477922251&atk=1drajn4egobjs800,"indeed_clk(this,'1295');",,,490c5af1906e11bb,False,False,False,Delta,30+ days ago,
Pre Sales Solution Architect,,Lagos,LA,NG,en,Lagos,NG Careers,"Tue, 03 Dec 2019 19:03:11 GMT","Provide <b>data</b> for sales collateral. With approximately 129,000 employees worldwide, including more than 19,000 engineers and <b>scientists</b>, we have an unrelenting…",http://ng.indeed.com/viewjob?jk=4ea46cee1f22e219&qd=_2otc9hbdFJBv5z8Fcdsn2-b0nnsPWs6xM_ANye41tl7mMKM2f9n9GD2lW0Xz8Xx3DmvYiquJUVtcw8CDr6KXVH5Y05AsHEKegFci4mEw_I&indpubnum=9091824477922251&atk=1drajn4egobjs800,"indeed_clk(this,'1295');",6.45407,3.39467,4ea46cee1f22e219,False,False,False,Lagos,1 day ago,
Full Stack Developer at ​Zercom Systems Nigeria Limited,careersome,Lagos,LA,NG,en,Lagos,careersome,"Thu, 01 Aug 2019 17:24:59 GMT",Work with <b>data</b> <b>scientists</b> and analysts to improve software. Create security and <b>data</b> protection settings. Zercom Systems Nigeria Limited is a privately held IT…,http://ng.indeed.com/viewjob?jk=b7796194d5a60e0b&qd=_2otc9hbdFJBv5z8Fcdsn2-b0nnsPWs6xM_ANye41tl7mMKM2f9n9GD2lW0Xz8Xx3DmvYiquJUVtcw8CDr6KXVH5Y05AsHEKegFci4mEw_I&indpubnum=9091824477922251&atk=1drajn4egobjs800,"indeed_clk(this,'1295');",6.45407,3.39467,b7796194d5a60e0b,False,False,False,Lagos,4 months ago,
Back End Developer at Webcoupers,careersome,Lagos,LA,NG,en,Lagos,careersome,"Thu, 14 Nov 2019 11:24:31 GMT","Manage a team of ad-hoc & in-house developers, <b>Data</b> <b>scientists</b> & other departments to develop products in-house and for clients.",http://ng.indeed.com/viewjob?jk=06dab90699db4e40&qd=_2otc9hbdFJBv5z8Fcdsn2-b0nnsPWs6xM_ANye41tl7mMKM2f9n9GD2lW0Xz8Xx3DmvYiquJUVtcw8CDr6KXVH5Y05AsHEKegFci4mEw_I&indpubnum=9091824477922251&atk=1drajn4egobjs800,"indeed_clk(this,'1295');",6.45407,3.39467,06dab90699db4e40,False,False,False,Lagos,20 days ago,
Content & Inbound Marketing Executive at Ignitia AB,careersome,Lagos,LA,NG,en,Lagos,careersome,"Mon, 01 Jul 2019 17:25:34 GMT","You will be supported by a small yet mighty team of <b>scientists</b>, marketers and technical experts. You are an excellent communicator and creative thinker with the…",http://ng.indeed.com/viewjob?jk=1bc638daccff9d13&qd=_2otc9hbdFJBv5z8Fcdsn2-b0nnsPWs6xM_ANye41tl7mMKM2f9n9GD2lW0Xz8Xx3DmvYiquJUVtcw8CDr6KXVH5Y05AsHEKegFci4mEw_I&indpubnum=9091824477922251&atk=1drajn4egobjs800,"indeed_clk(this,'1295');",6.45407,3.39467,1bc638daccff9d13,False,False,False,Lagos,5 months ago,
Channel Account Manager,,Lagos,LA,NG,en,Lagos,NG Careers,"Tue, 03 Dec 2019 19:03:16 GMT",Take responsibility for the <b>data</b> integrity in the system. Keep the CRM system up to date with all sales related activity including (but not limited to) meeting…,http://ng.indeed.com/viewjob?jk=726e9c447331bd0f&qd=_2otc9hbdFJBv5z8Fcdsn2-b0nnsPWs6xM_ANye41tl7mMKM2f9n9GD2lW0Xz8Xx3DmvYiquJUVtcw8CDr6KXVH5Y05AsHEKegFci4mEw_I&indpubnum=9091824477922251&atk=1drajn4egobjs800,"indeed_clk(this,'1295');",6.45407,3.39467,726e9c447331bd0f,False,False,False,Lagos,1 day ago,
Senior Sales Specialist,,Lagos,LA,NG,en,Lagos,NG Careers,"Tue, 03 Dec 2019 19:03:13 GMT","Analyzing sales and marketing <b>data</b> to determine further growth opportunities. With approximately 129,000 employees worldwide, including more than 19,000…",http://ng.indeed.com/viewjob?jk=66a8d07e7486b33c&qd=_2otc9hbdFJBv5z8Fcdsn2-b0nnsPWs6xM_ANye41tl7mMKM2f9n9GD2lW0Xz8Xx3DmvYiquJUVtcw8CDr6KXVH5Y05AsHEKegFci4mEw_I&indpubnum=9091824477922251&atk=1drajn4egobjs800,"indeed_clk(this,'1295');",6.45407,3.39467,66a8d07e7486b33c,False,False,False,Lagos,1 day ago,
Data Scientist,Xyples LLC,Lagos,LA,NG,en,Lagos,Indeed,"Tue, 13 Aug 2019 10:24:17 GMT","Experience using other programming and <b>data</b> manipulation languages preferred (SQL, Hive, Pig, Python, C/C++, Java). 3 months and 12 months for employment date.",http://ng.indeed.com/viewjob?jk=a6f7888a933ca19d&qd=_2otc9hbdFJBv5z8Fcdsn2-b0nnsPWs6xM_ANye41tl7mMKM2f9n9GD2lW0Xz8Xx3DmvYiquJUVtcw8CDr6KXVH5Y05AsHEKegFci4mEw_I&indpubnum=9091824477922251&atk=1drajn4egobjs800,"indeed_clk(this,'1295');",6.45407,3.39467,a6f7888a933ca19d,False,False,True,Lagos,30+ days ago,
MEDICAL LABORATORY SCIENTIST,Obijackson Foundation,Uruobo-Okija,AN,NG,en,Uruobo-Okija,Obijackson Foundation,"Fri, 13 Sep 2019 13:21:11 GMT","Make use of information technology to accurately record and analyse <b>data</b>, write reports and share results. Interested candidates should forward their curriculum…",http://ng.indeed.com/viewjob?jk=315bad921278e1aa&qd=_2otc9hbdFJBv5z8Fcdsn2-b0nnsPWs6xM_ANye41tl7mMKM2f9n9GD2lW0Xz8Xx3DmvYiquJUVtcw8CDr6KXQ8VPTADZV-0I1OB8xFPxkU&indpubnum=9091824477922251&atk=1drajn53vovjf800,"indeed_clk(this,'1983');",5.90016,6.84312,315bad921278e1aa,False,False,True,Uruobo-Okija,30+ days ago,
User Experience Researcher,Renmoney,Lagos,LA,NG,en,Lagos,RenMoney,"Tue, 15 Oct 2019 03:23:32 GMT","Our teams include designers, <b>data</b> <b>scientists</b>, content strategists, and engineers who are passionate about quality, usability, and simplicity.",http://ng.indeed.com/viewjob?jk=97c0e0ad82be144d&qd=_2otc9hbdFJBv5z8Fcdsn2-b0nnsPWs6xM_ANye41tl7mMKM2f9n9GD2lW0Xz8Xx3DmvYiquJUVtcw8CDr6KXQ8VPTADZV-0I1OB8xFPxkU&indpubnum=9091824477922251&atk=1drajn53vovjf800,"indeed_clk(this,'1983');",6.45407,3.39467,97c0e0ad82be144d,False,False,True,Lagos,30+ days ago,
Google Cloud,Xyples LLC,Lagos,LA,NG,en,Lagos,Indeed,"Tue, 19 Nov 2019 04:43:40 GMT","Prior experience working as/with Machine Learning Engineers, <b>Data</b> Engineers, or <b>Data</b> <b>Scientists</b>. In-depth knowledge of popular database and <b>data</b> warehouse…",http://ng.indeed.com/viewjob?jk=aac775ac2cf4cdd5&qd=_2otc9hbdFJBv5z8Fcdsn2-b0nnsPWs6xM_ANye41tl7mMKM2f9n9GD2lW0Xz8Xx3DmvYiquJUVtcw8CDr6KXQ8VPTADZV-0I1OB8xFPxkU&indpubnum=9091824477922251&atk=1drajn53vovjf800,"indeed_clk(this,'1983');",6.45407,3.39467,aac775ac2cf4cdd5,False,False,True,Lagos,16 days ago,
Economist,Xyples LLC,Lagos,LA,NG,en,Lagos,Indeed,"Mon, 19 Aug 2019 09:21:12 GMT","Work closely with our applied <b>scientists</b> and engineers to productional models. You will develop a deep understanding of our mission, <b>data</b> sources, metrics.",http://ng.indeed.com/viewjob?jk=5d97697b9e58f2b8&qd=_2otc9hbdFJBv5z8Fcdsn2-b0nnsPWs6xM_ANye41tl7mMKM2f9n9GD2lW0Xz8Xx3DmvYiquJUVtcw8CDr6KXQ8VPTADZV-0I1OB8xFPxkU&indpubnum=9091824477922251&atk=1drajn53vovjf800,"indeed_clk(this,'1983');",6.45407,3.39467,5d97697b9e58f2b8,False,False,True,Lagos,30+ days ago,
Natural Language Processing Analyst,Xyples LLC,Lagos,LA,NG,en,Lagos,Indeed,"Mon, 12 Aug 2019 20:54:29 GMT","Lead the ETL process to ingest structured <b>data</b> and annotation processes to enrich unstructured <b>data</b> leveraging a variety of <b>data</b> sources (social media, news,…",http://ng.indeed.com/viewjob?jk=478d4c1c61427673&qd=_2otc9hbdFJBv5z8Fcdsn2-b0nnsPWs6xM_ANye41tl7mMKM2f9n9GD2lW0Xz8Xx3DmvYiquJUVtcw8CDr6KXQ8VPTADZV-0I1OB8xFPxkU&indpubnum=9091824477922251&atk=1drajn53vovjf800,"indeed_clk(this,'1983');",6.45407,3.39467,478d4c1c61427673,False,False,True,Lagos,30+ days ago,
Full Stack Developer,Xyples LLC,Lagos,LA,NG,en,Lagos,Indeed,"Thu, 15 Aug 2019 16:34:34 GMT","Exploratory <b>data</b> visualization & analysis tools&mdash;apps to help <b>scientists</b> explore and understand diverse, complex, and multidimensional <b>data</b>.",http://ng.indeed.com/viewjob?jk=91701e46a7d47b4d&qd=_2otc9hbdFJBv5z8Fcdsn2-b0nnsPWs6xM_ANye41tl7mMKM2f9n9GD2lW0Xz8Xx3DmvYiquJUVtcw8CDr6KXQ8VPTADZV-0I1OB8xFPxkU&indpubnum=9091824477922251&atk=1drajn53vovjf800,"indeed_clk(this,'1983');",6.45407,3.39467,91701e46a7d47b4d,False,False,True,Lagos,30+ days ago,
Medical Laboratory Scientist at WellMed Healthcare​,careersome,Lagos,LA,NG,en,Lagos,careersome,"Thu, 19 Sep 2019 11:24:31 GMT","Makes use of the laboratory computer systems to place testing <b>data</b>, generate reports of testing result. WellMed Healthcare, a Medical diagnostics centre in Ajah…",http://ng.indeed.com/viewjob?jk=afa99d7808700e29&qd=_2otc9hbdFJBv5z8Fcdsn2-b0nnsPWs6xM_ANye41tl7mMKM2f9n9GD2lW0Xz8Xx3DmvYiquJUVtcw8CDr6KXQ8VPTADZV-0I1OB8xFPxkU&indpubnum=9091824477922251&atk=1drajn53vovjf800,"indeed_clk(this,'1983');",6.45407,3.39467,afa99d7808700e29,False,False,True,Lagos,30+ days ago,
Data Scientist,IQVIA,,,MA,en,Maroc,IQVIA,"Tue, 26 Nov 2019 20:04:12 GMT","Knowledge of healthcare patient-level <b>data</b>. IQVIA™ is The Human <b>Data</b> Science Company™, focused on using <b>data</b> and science to help healthcare clients find better…",http://ma.indeed.com/viewjob?jk=4d4389aef38973ad&qd=_2otc9hbdFJBv5z8Fcdsn2-b0nnsPWs6xM_ANye41tm1a7TLczUxL0C7eiEmw7i13DmvYiquJUVtcw8CDr6KXQnA_gC0tcZPYngtjOs_iv8&indpubnum=9091824477922251&atk=1drajn6inf2dq800,"indeed_clk(this,'3479');",,,4d4389aef38973ad,False,False,False,Maroc,il y a 8 jours,
