jobtitle,company,city,state,country,language,formattedLocation,source,date,snippet,url,onmousedown,latitude,longitude,jobkey,sponsored,expired,indeedApply,formattedLocationFull,formattedRelativeTime,stations
Data Scientist,Nihilent Limited,Bryanston,GP,ZA,en,"Bryanston, Gauteng",Indeed,"Tue, 03 Dec 2019 08:41:10 GMT","Google <b>Data</b> Studio, Microsoft PowerBI. Reviewing any <b>data</b> discrepancy reported by agencies or execs. Tracking and tagging all the digital platforms:",http://www.indeed.co.za/viewjob?jk=cfddc9dcd78303f0&qd=_2otc9hbdFJBv5z8Fcdsn2-b0nnsPWs6xM_ANye41tkV07CpYWUlemtjEVO0vTDEY_-taoSSxwsGCgAqkHstTw3sZc274Pik9r_saii638g&indpubnum=9091824477922251&atk=1drajn1n3f2dq800,"indeed_clk(this,'8499');",-26.05,28.03333,cfddc9dcd78303f0,False,False,True,"Bryanston, Gauteng",2 days ago,
Data Scientist,iKhokha,Durban,ZN,ZA,en,"Durban, KwaZulu-Natal",iKhokha,"Sat, 23 Nov 2019 03:26:17 GMT",Document <b>data</b> processes and best practices for <b>data</b> quality. Combine <b>data</b> from disparate <b>data</b> sources and build meaningful <b>data</b> sets for reporting and business…,http://www.indeed.co.za/viewjob?jk=89ce0135a554423d&qd=_2otc9hbdFJBv5z8Fcdsn2-b0nnsPWs6xM_ANye41tkV07CpYWUlemtjEVO0vTDEY_-taoSSxwsGCgAqkHstTw3sZc274Pik9r_saii638g&indpubnum=9091824477922251&atk=1drajn1n3f2dq800,"indeed_clk(this,'8499');",-29.85,31.01667,89ce0135a554423d,False,False,True,"Durban, KwaZulu-Natal",12 days ago,
Data Scientist,Wire Speed Systems,Johannesburg,GP,ZA,en,"Johannesburg, Gauteng 2195",Indeed,"Mon, 07 Oct 2019 07:53:09 GMT",Develop custom <b>data</b> models and algorithms to apply to <b>data</b> sets. Assess the effectiveness and accuracy of new <b>data</b> sources and <b>data</b> gathering techniques.,http://www.indeed.co.za/viewjob?jk=3eba0c9299a5071b&qd=_2otc9hbdFJBv5z8Fcdsn2-b0nnsPWs6xM_ANye41tkV07CpYWUlemtjEVO0vTDEY_-taoSSxwsGCgAqkHstTw3sZc274Pik9r_saii638g&indpubnum=9091824477922251&atk=1drajn1n3f2dq800,"indeed_clk(this,'8499');",-26.2,28.0833,3eba0c9299a5071b,False,False,True,"Johannesburg, Gauteng 2195",30+ days ago,
Senior Data scientist (NLP/ Computer Vision),Cape Town AI,Cape Town,WC,ZA,en,"Cape Town, Western Cape",Indeed,"Tue, 26 Nov 2019 12:00:20 GMT",University Graduate with at least 2+ years experience as a <b>data</b> scientist/engineer/strategist. Lots of hands-on experience with building machine learning models…,http://www.indeed.co.za/viewjob?jk=4fe99fbb207fea0a&qd=_2otc9hbdFJBv5z8Fcdsn2-b0nnsPWs6xM_ANye41tkV07CpYWUlemtjEVO0vTDEY_-taoSSxwsGCgAqkHstTw3sZc274Pik9r_saii638g&indpubnum=9091824477922251&atk=1drajn1n3f2dq800,"indeed_clk(this,'8499');",-33.91667,18.41667,4fe99fbb207fea0a,False,False,True,"Cape Town, Western Cape",8 days ago,
Senior Data Scientist,Luno,Johannesburg,GP,ZA,en,"Johannesburg, Gauteng",Luno,"Thu, 28 Nov 2019 12:33:09 GMT","As Senior <b>Data</b> <b>Scientist</b>, you will be part of Gorden's team, meet him here. Solid understanding of exploratory <b>data</b> analysis, predictive analytics, and…",http://www.indeed.co.za/viewjob?jk=c9b3656edfe9c8fc&qd=_2otc9hbdFJBv5z8Fcdsn2-b0nnsPWs6xM_ANye41tkV07CpYWUlemtjEVO0vTDEY_-taoSSxwsGCgAqkHstTw3sZc274Pik9r_saii638g&indpubnum=9091824477922251&atk=1drajn1n3f2dq800,"indeed_clk(this,'8499');",-26.20227,28.04363,c9b3656edfe9c8fc,False,False,True,"Johannesburg, Gauteng",6 days ago,
Data Scientist – Centurion,Hire Resolve,Centurion,GP,ZA,en,"Centurion, Gauteng",Hire Resolve,"Thu, 12 Sep 2019 14:36:39 GMT",A well-established development company in the telecoms space are looking for a passionate <b>Data</b> <b>Scientist</b> with experience in <b>Data</b> Warehouse Development for their…,http://www.indeed.co.za/viewjob?jk=8dee96a928b6a34e&qd=_2otc9hbdFJBv5z8Fcdsn2-b0nnsPWs6xM_ANye41tkV07CpYWUlemtjEVO0vTDEY_-taoSSxwsGCgAqkHstTw3sZc274Pik9r_saii638g&indpubnum=9091824477922251&atk=1drajn1n3f2dq800,"indeed_clk(this,'8499');",-25.87444,28.17056,8dee96a928b6a34e,False,False,False,"Centurion, Gauteng",30+ days ago,
Data Scientist,PEPKOR,Parow,WC,ZA,en,"Parow, Western Cape",Indeed,"Tue, 03 Dec 2019 08:20:45 GMT","We are looking for a <b>Data</b> <b>Scientist</b> that will help us discover the information hidden in vast amounts of <b>data</b>, and help us make smarter decisions to deliver…",http://www.indeed.co.za/viewjob?jk=c38c5c8e02072eb0&qd=_2otc9hbdFJBv5z8Fcdsn2-b0nnsPWs6xM_ANye41tkV07CpYWUlemtjEVO0vTDEY_-taoSSxwsGCgAqkHstTw3sZc274Pik9r_saii638g&indpubnum=9091824477922251&atk=1drajn1n3f2dq800,"indeed_clk(this,'8499');",-33.9,18.6,c38c5c8e02072eb0,False,False,True,"Parow, Western Cape",2 days ago,
Data Scientist,Tumaini Consulting,Centurion,GP,ZA,en,"Centurion, Gauteng",Tumaini Consulting,"Wed, 30 Oct 2019 10:21:44 GMT",2 years+ experience as a <b>Data</b> <b>Scientist</b>. A large Financial Institution in Centurion is looking for a <b>Data</b> <b>Scientist</b> to join their team.,http://www.indeed.co.za/viewjob?jk=664b8fb467dedd77&qd=_2otc9hbdFJBv5z8Fcdsn2-b0nnsPWs6xM_ANye41tkV07CpYWUlemtjEVO0vTDEY_-taoSSxwsGCgAqkHstTw3sZc274Pik9r_saii638g&indpubnum=9091824477922251&atk=1drajn1n3f2dq800,"indeed_clk(this,'8499');",-25.87444,28.17056,664b8fb467dedd77,False,False,True,"Centurion, Gauteng",30+ days ago,
Data Scientist/Data Analyst,Tumaini Consulting,Centurion,GP,ZA,en,"Centurion, Gauteng",Tumaini Consulting,"Tue, 12 Nov 2019 16:21:22 GMT",An esteemed insurance firm based in Centurion is seeking an enthusiastic <b>data</b> analyst or <b>data</b> <b>scientist</b> to join their team. Are you passionate about <b>data</b>?,http://www.indeed.co.za/viewjob?jk=572f2ebd154c427a&qd=_2otc9hbdFJBv5z8Fcdsn2-b0nnsPWs6xM_ANye41tkV07CpYWUlemtjEVO0vTDEY_-taoSSxwsGCgAqkHstTw3sZc274Pik9r_saii638g&indpubnum=9091824477922251&atk=1drajn1n3f2dq800,"indeed_clk(this,'8499');",-25.87444,28.17056,572f2ebd154c427a,False,False,True,"Centurion, Gauteng",22 days ago,
Data Scientist (Actuarial Background),Tumaini Consulting,Johannesburg,GP,ZA,en,"Johannesburg, Gauteng",Tumaini Consulting,"Thu, 31 Oct 2019 10:21:29 GMT",Are you an Actuarial Analyst currently within a <b>Data</b> <b>Scientist</b> position? Currently within a <b>Data</b> Science position. A minimum of 6 Exams.,http://www.indeed.co.za/viewjob?jk=c57909fa76f2e648&qd=_2otc9hbdFJBv5z8Fcdsn2-b0nnsPWs6xM_ANye41tkV07CpYWUlemtjEVO0vTDEY_-taoSSxwsGCgAqkHstTw3sZc274Pik9r_saii638g&indpubnum=9091824477922251&atk=1drajn1n3f2dq800,"indeed_clk(this,'8499');",-26.20227,28.04363,c57909fa76f2e648,False,False,True,"Johannesburg, Gauteng",30+ days ago,
Data Scientist – Machine Learning,Mass Staffing Projects,Johannesburg,GP,ZA,en,"Johannesburg, Gauteng",Mass Staffing Projects,"Thu, 07 Nov 2019 18:32:36 GMT",5 Years’ Experience in the Quants and <b>data</b> space. The purpose of this role is to use <b>data</b> to optimise products to maximise profits for the business.,http://www.indeed.co.za/viewjob?jk=4aa85c68c775f1c8&qd=_2otc9hbdFJBv5z8Fcdsn2-b0nnsPWs6xM_ANye41tkV07CpYWUlemtjEVO0vTDEY_-taoSSxwsGCgAqkHstTw3sZc274Pik9r_saii638g&indpubnum=9091824477922251&atk=1drajn1n3f2dq800,"indeed_clk(this,'8499');",-26.20227,28.04363,4aa85c68c775f1c8,False,False,True,"Johannesburg, Gauteng",27 days ago,
Data Scientist,Tumaini Consulting,Pretoria,GP,ZA,en,"Pretoria, Gauteng",Tumaini Consulting,"Tue, 29 Oct 2019 10:21:25 GMT","5-7 years’ experience as a <b>Data</b> <b>Scientist</b>. Knowledge of <b>Data</b> Warehousing, Multi-dimensional <b>data</b> analytics and Cloud-Based Big <b>Data</b> environments.",http://www.indeed.co.za/viewjob?jk=21c22596cc72a088&qd=_2otc9hbdFJBv5z8Fcdsn2-b0nnsPWs6xM_ANye41tkV07CpYWUlemtjEVO0vTDEY_-taoSSxwsGCgAqkHstTw3sZc274Pik9r_saii638g&indpubnum=9091824477922251&atk=1drajn1n3f2dq800,"indeed_clk(this,'8499');",-25.74486,28.18783,21c22596cc72a088,False,False,True,"Pretoria, Gauteng",30+ days ago,
Data Scientist,Tumaini Consulting,Johannesburg,GP,ZA,en,"Johannesburg, Gauteng",Tumaini Consulting,"Thu, 31 Oct 2019 10:21:27 GMT","Experience in Machine Learning, Big <b>Data</b> and AI. The ideal candidate will have a BSc Actuarial Science degree, made good progress with CT exams and have…",http://www.indeed.co.za/viewjob?jk=5ed8b80da7f5ac72&qd=_2otc9hbdFJBv5z8Fcdsn2-b0nnsPWs6xM_ANye41tkV07CpYWUlemtjEVO0vTDEY_-taoSSxwsGCgAqkHstTw3sZc274Pik9r_saii638g&indpubnum=9091824477922251&atk=1drajn1n3f2dq800,"indeed_clk(this,'8499');",-26.20227,28.04363,5ed8b80da7f5ac72,False,False,True,"Johannesburg, Gauteng",30+ days ago,
Data Scientist,Goldman Tech Resourcing,Johannesburg,GP,ZA,en,"Johannesburg, Gauteng",Goldman Tech Resourcing,"Thu, 05 Sep 2019 16:06:55 GMT",They are looking for a Junior <b>Data</b> <b>Scientist</b> to join their team. An exciting opportunity exists at a well-known Insurance firm based in Johannesburg.,http://www.indeed.co.za/viewjob?jk=023f386523d0c8f9&qd=_2otc9hbdFJBv5z8Fcdsn2-b0nnsPWs6xM_ANye41tkV07CpYWUlemtjEVO0vTDEY_-taoSSxwsGCgAqkHstTw3sZc274Pik9r_saii638g&indpubnum=9091824477922251&atk=1drajn1n3f2dq800,"indeed_clk(this,'8499');",-26.20227,28.04363,023f386523d0c8f9,False,False,True,"Johannesburg, Gauteng",30+ days ago,
Field Application Scientist,Complete Genomics,Cape Town,WC,ZA,en,"Cape Town, Western Cape",Complete Genomics,"Wed, 21 Aug 2019 22:01:36 GMT","Field Application <b>Scientist</b> (Cape Town, South Africa). Troubleshoot issues related to experimental design, <b>data</b> processing, software operation, sample…",http://www.indeed.co.za/viewjob?jk=b9712a1df710967f&qd=_2otc9hbdFJBv5z8Fcdsn2-b0nnsPWs6xM_ANye41tkV07CpYWUlemtjEVO0vTDEY_-taoSSxwsGCgAqkHstTw3sZc274Pik9r_saii638g&indpubnum=9091824477922251&atk=1drajn1n3f2dq800,"indeed_clk(this,'8499');",-33.91667,18.41667,b9712a1df710967f,False,False,True,"Cape Town, Western Cape",30+ days ago,
Data Scientist,Let's Recruit,Centurion,GP,ZA,en,"Centurion, Gauteng",Indeed,"Mon, 25 Nov 2019 16:15:37 GMT","5-8 years' <b>data</b> analysis experience. Create and deliver data-driven solutions that add business value through the use of statistical models, machine learning…",http://www.indeed.co.za/viewjob?jk=156a27bf73ad007d&qd=_2otc9hbdFJBv5z8Fcdsn2-b0nnsPWs6xM_ANye41tkV07CpYWUlemtjEVO0vTDEY_-taoSSxwsGCgAqkHstTw3sZc274Pik9r_saii638g&indpubnum=9091824477922251&atk=1drajn1n3f2dq800,"indeed_clk(this,'8499');",-25.87444,28.17056,156a27bf73ad007d,False,False,True,"Centurion, Gauteng",9 days ago,
Head Data TPS,Adept Advisory (Pty) Ltd,Sandton,GP,ZA,en,"Sandton, Gauteng",Indeed,"Tue, 19 Nov 2019 10:36:38 GMT",Management of team of <b>data</b> <b>scientists</b> and developers. Monitoring and analytics of <b>data</b> trends. Building and implementation of new <b>Data</b> Practice to be rolled out…,http://www.indeed.co.za/viewjob?jk=099ea2f2c8c2c1ad&qd=_2otc9hbdFJBv5z8Fcdsn2-b0nnsPWs6xM_ANye41tkV07CpYWUlemtjEVO0vTDEY_-taoSSxwsGCgAqkHstTw3sZc274Pik9r_saii638g&indpubnum=9091824477922251&atk=1drajn1n3f2dq800,"indeed_clk(this,'8499');",-26.101385,28.04619,099ea2f2c8c2c1ad,False,False,True,"Sandton, Gauteng",15 days ago,
Fraud Data Scientist,Luno,Cape Town,WC,ZA,en,"Cape Town, Western Cape",Luno,"Wed, 04 Dec 2019 16:34:14 GMT","As Fraud <b>Data</b> <b>Scientist</b>, you will be part of Gorden's team, meet him here. Identifying opportunities in the business that could benefit most from cognitive…",http://www.indeed.co.za/viewjob?jk=9fe55ef27c8c5641&qd=_2otc9hbdFJBv5z8Fcdsn2-b0nnsPWs6xM_ANye41tkV07CpYWUlemtjEVO0vTDEY_-taoSSxwsGCgAqkHstTw3sZc274Pik9r_saii638g&indpubnum=9091824477922251&atk=1drajn1n3f2dq800,"indeed_clk(this,'8499');",-33.91667,18.41667,9fe55ef27c8c5641,False,False,True,"Cape Town, Western Cape",16 hours ago,
Data Scientist Associate,Luno,Cape Town,WC,ZA,en,"Cape Town, Western Cape",Luno,"Thu, 28 Nov 2019 12:33:09 GMT","You will apply the scientific method to generate and test hypotheses to solve business needs through the use of <b>data</b> and analytics, including the use of machine…",http://www.indeed.co.za/viewjob?jk=d47e47a29b285f2b&qd=_2otc9hbdFJBv5z8Fcdsn2-b0nnsPWs6xM_ANye41tkV07CpYWUlemtjEVO0vTDEY_-taoSSxwsGCgAqkHstTw3sZc274Pik9r_saii638g&indpubnum=9091824477922251&atk=1drajn1n3f2dq800,"indeed_clk(this,'8499');",-33.91667,18.41667,d47e47a29b285f2b,False,False,True,"Cape Town, Western Cape",6 days ago,
DATA SCIENTIST | HIRT & CARTER,Hirt & Carter,Durban,ZN,ZA,en,"Durban, KwaZulu-Natal",Hirt & Carter,"Mon, 18 Feb 2019 14:26:17 GMT",The development of <b>data</b> requirements for business systems and <b>data</b> requirements that support digital products. CORE PURPOSE OF THE JOB:,http://www.indeed.co.za/viewjob?jk=3acfc38d6ad9b3d5&qd=_2otc9hbdFJBv5z8Fcdsn2-b0nnsPWs6xM_ANye41tkV07CpYWUlemtjEVO0vTDEY_-taoSSxwsGCgAqkHstTw3sZc274Pik9r_saii638g&indpubnum=9091824477922251&atk=1drajn1n3f2dq800,"indeed_clk(this,'8499');",-29.85,31.01667,3acfc38d6ad9b3d5,False,False,True,"Durban, KwaZulu-Natal",9 months ago,
Full Stack Developer,The Change Lab,Johannesburg,GP,ZA,en,"Johannesburg, Gauteng",Indeed,"Mon, 14 Oct 2019 09:43:17 GMT","Work with <b>data</b> <b>scientists</b> and analysts to improve software. Ability to write code, design and implement software and analyze <b>data</b>.",http://www.indeed.co.za/viewjob?jk=e9bf4492029fdfe7&qd=_2otc9hbdFJBv5z8Fcdsn2-b0nnsPWs6xM_ANye41tkV07CpYWUlemtjEVO0vTDEY_-taoSSxwsGCgAqkHstT_mLLiO7ijuO4vHeXqrsuqw&indpubnum=9091824477922251&atk=1drajn2dnblv4800,"indeed_clk(this,'9194');",-26.20227,28.04363,e9bf4492029fdfe7,False,False,True,"Johannesburg, Gauteng",30+ days ago,
Data Engineer/Data Scientist,SET Consulting,Braamfontein,GP,ZA,en,"Braamfontein, Gauteng",SET Consulting,"Fri, 29 Nov 2019 18:27:06 GMT","My client is in search of a <b>Data</b> Engineer/Scientist within the insurance field. Degree in IT, Computer Science or similar NQF 7 qualification.",http://www.indeed.co.za/viewjob?jk=449b1445b40c62d4&qd=_2otc9hbdFJBv5z8Fcdsn2-b0nnsPWs6xM_ANye41tkV07CpYWUlemtjEVO0vTDEY_-taoSSxwsGCgAqkHstT_mLLiO7ijuO4vHeXqrsuqw&indpubnum=9091824477922251&atk=1drajn2dnblv4800,"indeed_clk(this,'9194');",-26.198133,28.021814,449b1445b40c62d4,False,False,True,"Braamfontein, Gauteng",5 days ago,
Coding Mentor,CoGrammar,Johannesburg,GP,ZA,en,"Johannesburg, Gauteng",CoGrammar,"Mon, 23 Sep 2019 16:57:28 GMT","HyperionDev provides coding bootcamps, online and through our physical campuses, supporting learners from over 40 countries worldwide, and helping people switch…",http://www.indeed.co.za/viewjob?jk=2ee1e3c15d88e6ba&qd=_2otc9hbdFJBv5z8Fcdsn2-b0nnsPWs6xM_ANye41tkV07CpYWUlemtjEVO0vTDEY_-taoSSxwsGCgAqkHstT_mLLiO7ijuO4vHeXqrsuqw&indpubnum=9091824477922251&atk=1drajn2dnblv4800,"indeed_clk(this,'9194');",-26.20227,28.04363,2ee1e3c15d88e6ba,False,False,True,"Johannesburg, Gauteng",30+ days ago,
Data Scientist,Goldman Tech Resourcing,,GP,ZA,en,Gauteng,Goldman Tech Resourcing,"Thu, 28 Nov 2019 16:06:43 GMT",They are looking for a <b>Data</b> <b>Scientist</b> to join their team. An exciting opportunity exists at a well-known Telecoms company based in Johannesburg.,http://www.indeed.co.za/viewjob?jk=4e7af84fc9c9687a&qd=_2otc9hbdFJBv5z8Fcdsn2-b0nnsPWs6xM_ANye41tkV07CpYWUlemtjEVO0vTDEY_-taoSSxwsGCgAqkHstT_mLLiO7ijuO4vHeXqrsuqw&indpubnum=9091824477922251&atk=1drajn2dnblv4800,"indeed_clk(this,'9194');",,,4e7af84fc9c9687a,False,False,True,Gauteng,6 days ago,
Data Scientist,Hire Resolve,Johannesburg,GP,ZA,en,"Johannesburg, Gauteng",Hire Resolve,"Mon, 09 Sep 2019 14:35:26 GMT","4-7 years’ experience in <b>data</b> engineering, <b>data</b> sciences or related. One of our Information Technology Clients, who focus on Business Transformation and Project…",http://www.indeed.co.za/viewjob?jk=7ba50009655d75f9&qd=_2otc9hbdFJBv5z8Fcdsn2-b0nnsPWs6xM_ANye41tkV07CpYWUlemtjEVO0vTDEY_-taoSSxwsGCgAqkHstT_mLLiO7ijuO4vHeXqrsuqw&indpubnum=9091824477922251&atk=1drajn2dnblv4800,"indeed_clk(this,'9194');",-26.20227,28.04363,7ba50009655d75f9,False,False,False,"Johannesburg, Gauteng",30+ days ago,
IT Data Scientist – JHB,Hire Resolve,Johannesburg,GP,ZA,en,"Johannesburg, Gauteng",Hire Resolve,"Fri, 29 Nov 2019 20:34:54 GMT","Understand the impact of big <b>data</b> and machine <b>data</b> trends, as well as emerging <b>data</b> science technologies on our clients and their customers.",http://www.indeed.co.za/viewjob?jk=3b151252f9cdc172&qd=_2otc9hbdFJBv5z8Fcdsn2-b0nnsPWs6xM_ANye41tkV07CpYWUlemtjEVO0vTDEY_-taoSSxwsGCgAqkHstT_mLLiO7ijuO4vHeXqrsuqw&indpubnum=9091824477922251&atk=1drajn2dnblv4800,"indeed_clk(this,'9194');",-26.20227,28.04363,3b151252f9cdc172,False,False,False,"Johannesburg, Gauteng",5 days ago,
Data Scientist – JHB,Hire Resolve,Johannesburg,GP,ZA,en,"Johannesburg, Gauteng",Hire Resolve,"Fri, 29 Nov 2019 14:35:45 GMT",One of our Leading Insurance Clients in Johannesburg is currently looking for a <b>Data</b> <b>Scientist</b> to join their dynamic and fast-growing team.,http://www.indeed.co.za/viewjob?jk=b484aad7f947ef9a&qd=_2otc9hbdFJBv5z8Fcdsn2-b0nnsPWs6xM_ANye41tkV07CpYWUlemtjEVO0vTDEY_-taoSSxwsGCgAqkHstT_mLLiO7ijuO4vHeXqrsuqw&indpubnum=9091824477922251&atk=1drajn2dnblv4800,"indeed_clk(this,'9194');",-26.20227,28.04363,b484aad7f947ef9a,False,False,False,"Johannesburg, Gauteng",5 days ago,
Data Scientist & Data Analysts JHB,Hire Resolve,Johannesburg,GP,ZA,en,"Johannesburg, Gauteng",Hire Resolve,"Thu, 21 Nov 2019 14:37:18 GMT",One of our leading brands in Telecom in Johannesburg is currently looking for <b>Data</b> <b>Scientists</b> and <b>Data</b> Analysts to join their team.,http://www.indeed.co.za/viewjob?jk=a1f4c2d755594691&qd=_2otc9hbdFJBv5z8Fcdsn2-b0nnsPWs6xM_ANye41tkV07CpYWUlemtjEVO0vTDEY_-taoSSxwsGCgAqkHstT_mLLiO7ijuO4vHeXqrsuqw&indpubnum=9091824477922251&atk=1drajn2dnblv4800,"indeed_clk(this,'9194');",-26.20227,28.04363,a1f4c2d755594691,False,False,False,"Johannesburg, Gauteng",13 days ago,
Data Scientist Consultant,Goldman Tech Resourcing,Johannesburg,GP,ZA,en,"Johannesburg, Gauteng",Goldman Tech Resourcing,"Fri, 01 Nov 2019 16:05:53 GMT","They are looking for a <b>Data</b> <b>Scientist</b> Consultant to join their team. Worked on big <b>data</b> platforms (Cloudera / Hortonworks, MapR, or Pivotal).",http://www.indeed.co.za/viewjob?jk=ad4fc23a36ef8e93&qd=_2otc9hbdFJBv5z8Fcdsn2-b0nnsPWs6xM_ANye41tkV07CpYWUlemtjEVO0vTDEY_-taoSSxwsGCgAqkHstT_mLLiO7ijuO4vHeXqrsuqw&indpubnum=9091824477922251&atk=1drajn2dnblv4800,"indeed_clk(this,'9194');",-26.20227,28.04363,ad4fc23a36ef8e93,False,False,True,"Johannesburg, Gauteng",30+ days ago,
Senior Data Analyst,Tumaini Consulting,Johannesburg,GP,ZA,en,"Johannesburg, Gauteng",Tumaini Consulting,"Tue, 15 Oct 2019 10:22:11 GMT","Experience as a <b>Data</b> Analyst/Data <b>Scientist</b>. The candidate will turn <b>data</b> into information, information into insight and insight into business decisions.",http://www.indeed.co.za/viewjob?jk=6a0afdbe71998593&qd=_2otc9hbdFJBv5z8Fcdsn2-b0nnsPWs6xM_ANye41tkV07CpYWUlemtjEVO0vTDEY_-taoSSxwsGCgAqkHstT_mLLiO7ijuO4vHeXqrsuqw&indpubnum=9091824477922251&atk=1drajn2dnblv4800,"indeed_clk(this,'9194');",-26.20227,28.04363,6a0afdbe71998593,False,False,True,"Johannesburg, Gauteng",30+ days ago,
Postdoctoral Research Fellow,"Stellenbosch University, CLIME Research Group",Cape Town,WC,ZA,en,"Cape Town, Western Cape",Indeed,"Fri, 18 Oct 2019 09:26:42 GMT",The Clinical Mycobacteriology & Epidemiology (CLIME) group is seeking to fill two exciting post-doctoral <b>scientist</b> positions related to the diagnosis of…,http://www.indeed.co.za/viewjob?jk=d1318d6be55537bb&qd=_2otc9hbdFJBv5z8Fcdsn2-b0nnsPWs6xM_ANye41tkV07CpYWUlemtjEVO0vTDEY_-taoSSxwsGCgAqkHstT_mLLiO7ijuO4vHeXqrsuqw&indpubnum=9091824477922251&atk=1drajn2dnblv4800,"indeed_clk(this,'9194');",-33.91667,18.41667,d1318d6be55537bb,False,False,True,"Cape Town, Western Cape",30+ days ago,
Machine Learning Engineer,Business Capital Group,Paardeneiland,WC,ZA,en,"Paardeneiland, Western Cape",Indeed,"Thu, 14 Nov 2019 06:30:27 GMT", Contribute towards the design and deployment of <b>data</b> pipelines to source validate and transform <b>data</b>.  At least 5 year experience applying <b>data</b> science…,http://www.indeed.co.za/viewjob?jk=115b6e4dba6cefc0&qd=_2otc9hbdFJBv5z8Fcdsn2-b0nnsPWs6xM_ANye41tkV07CpYWUlemtjEVO0vTDEY_-taoSSxwsGCgAqkHstT_mLLiO7ijuO4vHeXqrsuqw&indpubnum=9091824477922251&atk=1drajn2dnblv4800,"indeed_clk(this,'9194');",-33.91667,18.46667,115b6e4dba6cefc0,False,False,True,"Paardeneiland, Western Cape",21 days ago,
Medical Bioinformatician,University of Cape Town,Cape Town,WC,ZA,en,"Cape Town, Western Cape",University of Cape Town,"Fri, 22 Nov 2019 12:57:35 GMT",From raw <b>data</b> quality checks and <b>data</b> cleaning to differential. These <b>data</b> will be combined. “Research <b>Scientist</b> Application – Bioinformatician” Closing date:,http://www.indeed.co.za/viewjob?jk=b660c3a04ef4b91f&qd=_2otc9hbdFJBv5z8Fcdsn2-b0nnsPWs6xM_ANye41tkV07CpYWUlemtjEVO0vTDEY_-taoSSxwsGCgAqkHstT_mLLiO7ijuO4vHeXqrsuqw&indpubnum=9091824477922251&atk=1drajn2dnblv4800,"indeed_clk(this,'9194');",-33.91667,18.41667,b660c3a04ef4b91f,False,False,True,"Cape Town, Western Cape",12 days ago,
Senior Research Officer (Contract),University of Cape Town,Cape Town,WC,ZA,en,"Cape Town, Western Cape",University of Cape Town,"Fri, 15 Nov 2019 12:57:26 GMT",Experience using REDCap or other <b>data</b> management software. Demonstrable research experience related to <b>data</b> safety and monitoring in a clinical trial.,http://www.indeed.co.za/viewjob?jk=7befc356897a63d4&qd=_2otc9hbdFJBv5z8Fcdsn2-b0nnsPWs6xM_ANye41tkV07CpYWUlemtjEVO0vTDEY_-taoSSxwsGCgAqkHstT_mLLiO7ijuO4vHeXqrsuqw&indpubnum=9091824477922251&atk=1drajn2dnblv4800,"indeed_clk(this,'9194');",-33.91667,18.41667,7befc356897a63d4,False,False,True,"Cape Town, Western Cape",19 days ago,
SENIOR DATA SCIENTIST,e-Merge IT Recruitment,Johannesburg,GP,ZA,en,"Johannesburg, Gauteng",e-Merge IT Recruitment,"Thu, 21 Nov 2019 12:39:47 GMT",They require the <b>Data</b> <b>Scientist</b> to have: We have a cool opportunity for <b>Data</b> <b>Scientists</b> to join a brilliant cognitive automation company that use a.i and…,http://www.indeed.co.za/viewjob?jk=b35c878b99ba6db4&qd=_2otc9hbdFJBv5z8Fcdsn2-b0nnsPWs6xM_ANye41tkV07CpYWUlemtjEVO0vTDEY_-taoSSxwsGCgAqkHstT_mLLiO7ijuO4vHeXqrsuqw&indpubnum=9091824477922251&atk=1drajn2dnblv4800,"indeed_clk(this,'9194');",-26.20227,28.04363,b35c878b99ba6db4,False,False,True,"Johannesburg, Gauteng",13 days ago,
Integration Delivery Lead (Snr ETL Developer/Data Integrator/Data Scientist,Potencia Corp,Johannesburg,GP,ZA,en,"Johannesburg, Gauteng",Indeed,"Wed, 13 Nov 2019 05:20:42 GMT",Big <b>Data</b> - At least 1 years experience. Oracle <b>Data</b> Integrator - At least 3 years experience. Pentaho <b>Data</b> Integration (Kettle) - At least 3 years experience.,http://www.indeed.co.za/viewjob?jk=85714fc476a371eb&qd=_2otc9hbdFJBv5z8Fcdsn2-b0nnsPWs6xM_ANye41tkV07CpYWUlemtjEVO0vTDEY_-taoSSxwsGCgAqkHstT_mLLiO7ijuO4vHeXqrsuqw&indpubnum=9091824477922251&atk=1drajn2dnblv4800,"indeed_clk(this,'9194');",-26.20227,28.04363,85714fc476a371eb,False,False,True,"Johannesburg, Gauteng",22 days ago,
Business Intelligence Analyst - 12 month contract,ZealHR,Pretoria,GP,ZA,en,"Pretoria, Gauteng",ZealHR,"Wed, 30 Oct 2019 16:12:17 GMT",Proven experience as a BI Developer or <b>Data</b> <b>Scientist</b>. Dimensional modeling) and <b>data</b> mining. Background in <b>data</b> warehouse design (e.g. Up to R37 000 per month.,http://www.indeed.co.za/viewjob?jk=5ac75dc09dd30853&qd=_2otc9hbdFJBv5z8Fcdsn2-b0nnsPWs6xM_ANye41tkV07CpYWUlemtjEVO0vTDEY_-taoSSxwsGCgAqkHstT_mLLiO7ijuO4vHeXqrsuqw&indpubnum=9091824477922251&atk=1drajn2dnblv4800,"indeed_clk(this,'9194');",-25.74486,28.18783,5ac75dc09dd30853,False,False,True,"Pretoria, Gauteng",30+ days ago,
Machine Learning Educator,Shaw Academy,Cape Town,WC,ZA,en,"Cape Town, Western Cape",Indeed,"Fri, 25 Oct 2019 13:54:00 GMT",A degree in <b>Data</b> Science. Shaw Academy is seeking an experienced <b>Data</b> <b>Scientist</b> to use their skills and knowledge to educate thousands of students every month…,http://www.indeed.co.za/viewjob?jk=1d6a4d8d2d5c45f8&qd=_2otc9hbdFJBv5z8Fcdsn2-b0nnsPWs6xM_ANye41tkV07CpYWUlemtjEVO0vTDEY_-taoSSxwsGCgAqkHstT_mLLiO7ijuO4vHeXqrsuqw&indpubnum=9091824477922251&atk=1drajn2dnblv4800,"indeed_clk(this,'9194');",-33.91667,18.41667,1d6a4d8d2d5c45f8,False,False,True,"Cape Town, Western Cape",30+ days ago,
Data Engineer,SET Consulting,Sandton,GP,ZA,en,"Sandton, Gauteng",SET Consulting,"Wed, 04 Dec 2019 12:27:11 GMT","Finance Group with extensive opportunities seeks a <b>Data</b> <b>Scientist</b> with exceptional ability to work with, analyse and communicate findings from <b>data</b>.",http://www.indeed.co.za/viewjob?jk=2be4ba0be96b2efc&qd=_2otc9hbdFJBv5z8Fcdsn2-b0nnsPWs6xM_ANye41tkV07CpYWUlemtjEVO0vTDEY_-taoSSxwsGCgAqkHstT_mLLiO7ijuO4vHeXqrsuqw&indpubnum=9091824477922251&atk=1drajn2dnblv4800,"indeed_clk(this,'9194');",-26.101385,28.04619,2be4ba0be96b2efc,False,False,True,"Sandton, Gauteng",20 hours ago,
Data Engineer,SET Consulting,Fairland,GP,ZA,en,"Fairland, Gauteng",SET Consulting,"Mon, 25 Nov 2019 12:26:52 GMT","In this role, take accountability for designing, developing, implementing and maintaining a scalable and robust <b>data</b> integration interfaces and <b>data</b> models that…",http://www.indeed.co.za/viewjob?jk=28ade3d3f6748ced&qd=_2otc9hbdFJBv5z8Fcdsn2-b0nnsPWs6xM_ANye41tkV07CpYWUlemtjEVO0vTDEY_-taoSSxwsGCgAqkHstT_mLLiO7ijuO4vHeXqrsuqw&indpubnum=9091824477922251&atk=1drajn2dnblv4800,"indeed_clk(this,'9194');",-26.128817,27.945786,28ade3d3f6748ced,False,False,True,"Fairland, Gauteng",9 days ago,
